{
  "schema": "android-practices-provider-v1",
  "provider_id": "jinny-android-practices",
  "provider_version": "1.0.0",
  "compatible_core_contracts": ["android-engineering-ops-v1"],
  "capabilities": {
    "coding": {
      "contract": "android-coding-policy-provider-v1",
      "skill_id": "jinny-android-coding-practices",
      "skill_version": "1.0.0",
      "skill_sha256": "1111111111111111111111111111111111111111111111111111111111111111",
      "agent_metadata_sha256": "2222222222222222222222222222222222222222222222222222222222222222",
      "decision_entrypoint_path": "skills/jinny-android-coding-practices/scripts/jinny_coding_policy.py",
      "decision_entrypoint_sha256": "3333333333333333333333333333333333333333333333333333333333333333",
      "decision_schema": "coding-policy-decision-v1",
      "applicability": {"workflow_actions": ["implementation", "review"], "component_layers": ["application"]}
    },
    "execution": {
      "contract": "android-execution-policy-provider-v1",
      "skill_id": "jinny-android-execution-policy",
      "skill_version": "1.0.0",
      "skill_sha256": "4444444444444444444444444444444444444444444444444444444444444444",
      "agent_metadata_sha256": "5555555555555555555555555555555555555555555555555555555555555555",
      "decision_entrypoint_path": "skills/jinny-android-execution-policy/scripts/jinny_execution_policy.py",
      "decision_entrypoint_sha256": "6666666666666666666666666666666666666666666666666666666666666666",
      "decision_schema": "execution-policy-decision-v1",
      "applicability": {"workflow_actions": ["analysis"], "component_layers": ["application"]},
      "worker_profiles": {
        "analysis-reader": {
          "dispatch": {"model_id": "provider-owned-model", "reasoning_effort": "high"},
          "task_classes": ["analysis", "diagnosis"],
          "effect_ceiling": "read_only"
        }
      }
    }
  },
  "fallback": {
    "capability_absent": "core",
    "applicability_miss": "core",
    "provider_missing_or_invalid": "fail_closed",
    "declared_capability_broken": "fail_closed",
    "invalid_decision": "fail_closed"
  },
  "authority": {
    "decision_only": true,
    "can_spawn": false,
    "can_write_source": false,
    "can_acquire_lock": false,
    "can_execute_side_effects": false,
    "can_upload": false,
    "can_accept_gate": false,
    "can_final_accept": false
  }
}
