{
  "schema": "android-practices-provider-v1",
  "provider_id": "jinny-android-practices",
  "provider_version": "2.0.0",
  "compatible_core_contracts": [
    "android-engineering-ops-v1"
  ],
  "capabilities": {
    "coding": {
      "contract": "android-coding-policy-provider-v1",
      "skill_id": "jinny-android-coding-practices",
      "skill_version": "2.0.0",
      "skill_sha256": "8d595fd8f9ca7049e9323cef1c6bf24ec5e9fc223c91709fbf670eb8da92bca5",
      "agent_metadata_sha256": "7e181a24f1309f2772ee62b1c756f5986f4ef127bab2511975016aaff0b46704",
      "decision_entrypoint_path": "skills/jinny-android-coding-practices/scripts/jinny_coding_policy.py",
      "decision_entrypoint_sha256": "d8210bf5aa9563093762a93cba75922b709b4b99f3390120ccbd19135f9cda42",
      "decision_schema": "coding-policy-decision-v1",
      "applicability": {
        "workflow_actions": [
          "implementation",
          "review"
        ],
        "component_layers": [
          "application",
          "platform",
          "native",
          "hal",
          "kernel",
          "device",
          "build"
        ]
      }
    },
    "execution": {
      "contract": "android-execution-policy-provider-v1",
      "skill_id": "jinny-android-execution-policy",
      "skill_version": "2.0.0",
      "skill_sha256": "6e42e6e0a49067ac4a63c3e05e7ea1e012a15f2ef9d33da182cbcbddfcf84c03",
      "agent_metadata_sha256": "4996af83f9671d1e234f0e1f0f593032268f382e0dfe16f39ab22822277e13f5",
      "decision_entrypoint_path": "skills/jinny-android-execution-policy/scripts/jinny_execution_policy.py",
      "decision_entrypoint_sha256": "b0e8cfe2f54817c77d25ff3514b5fa4fbadbc7bd910c035e914d19ff7226464c",
      "decision_schema": "execution-policy-decision-v1",
      "applicability": {
        "workflow_actions": [
          "analysis",
          "diagnosis",
          "implementation",
          "review",
          "verification",
          "bounded_operation"
        ],
        "component_layers": [
          "application",
          "platform",
          "native",
          "hal",
          "kernel",
          "device",
          "build"
        ]
      },
      "worker_profiles": {
        "sol-analysis-review": {
          "dispatch": {
            "model_id": "gpt-5.6-sol",
            "reasoning_effort": "max"
          },
          "task_classes": [
            "analysis",
            "diagnosis",
            "review"
          ],
          "effect_ceiling": "read_only"
        },
        "terra-implementation": {
          "dispatch": {
            "model_id": "gpt-5.6-terra",
            "reasoning_effort": "high"
          },
          "task_classes": [
            "implementation",
            "analysis",
            "diagnosis"
          ],
          "effect_ceiling": "workspace_mutation"
        },
        "luna-verification-operation": {
          "dispatch": {
            "model_id": "gpt-5.6-luna",
            "reasoning_effort": "medium"
          },
          "task_classes": [
            "analysis",
            "diagnosis",
            "verification",
            "bounded_operation"
          ],
          "effect_ceiling": "controlled_operation"
        }
      }
    }
  },
  "fallback": {
    "capability_absent": "core",
    "applicability_miss": "core",
    "provider_missing_or_invalid": "fail_closed",
    "declared_capability_broken": "fail_closed",
    "invalid_decision": "fail_closed"
  },
  "authority": {
    "decision_only": true,
    "can_spawn": false,
    "can_write_source": false,
    "can_acquire_lock": false,
    "can_execute_side_effects": false,
    "can_upload": false,
    "can_accept_gate": false,
    "can_final_accept": false
  }
}
